226	Son of James Grey Turner and Eva Turner, of 2, Shaxloe Leazes, Hexham, Northumberland, England. Formerly Serjt. in Royal North West Mounted Police.	Fils de James Grey Turner et Eva Turner, de 2, Shaxloe Leazes, Hexham, Northumberland, Angleterre. Formerly Serjt. in Royal North West Mounted Police.	32	15		UN	/ww1/ww1515.jpg	27873	0	2800	ST. SEVER CEMETERY EXTENSION (ROUEN)	ANNEXE DU CIMETIÈRE DE ST-SEVER (ROUEN)			2	France	France	1887-11-03 00:00:00.0		03	09					15			1	Army	Armée	JAMES GREY	P. IX. C. 9A.	J G	276	Seine-Maritime	<p>The St. Sever Cemetery and Extension (Rouen) is situated about 3 kilometres south of Rouen Cathedral and a short distance west of the road from Rouen to Elbeuf.  If travelling from Elbeuf or Caen on the N.138, follow Avenue Des Canadiens right down to the roundabout.  Then take the fourth exit into Rue Stanislas De Jardin, and the cemetery lies 150 metres on the left.  The CWGC signpost is located at the entrance of the cemetery.  The cemetery covers an area of 49,885 square metres.</p><p>The War Stone is on the boundary of the original Cemetery and the Extension, facing the City of Rouen War Memorial. The Cross is raised on a terrace on the further side of the Extension. The Chapel, cruciform and surmounted by a dome, is in the middle of the Extension.</p>	<p>Le cimetière et l'annexe de St-Sever (Rouen) sont situés à environ 3 kilomètres au sud de la cathédrale de Rouen et à quelque distance de la route allant de Rouen à Elbeuf, en direction ouest.  En venant d'Elbeuf  ou Caen sur la route N138, suivez l'avenue des Canadiens jusqu'au carrefour giratoire. Prenez la quatrième sortie pour vous rendre sur la rue Stanislas-de-Jardin, et le cimetière se trouve sur la gauche, à 150 mètres.  Le panneau de la Commission des sépultures de guerre du Commonwealth se trouve à l'entrée du cimetière.  Le cimetière a une superficie de 49 885 mètres carrés.</p><p>La pierre commémorative se trouve à la limite du vieux cimetière et de la nouvelle partie, en face du Monument aux morts de la ville de Rouen. La Croix se dresse sur une terrasse, du côté de la nouvelle partie. La chapelle, cruciforme et surmontée d'une coupole, se trouve au milieu de la nouvelle partie.</p>	11	04		2800.gif	1900	Private	Soldat	235	Lord Strathcona's Horse (Royal Canadians), R.C.A.C.	Lord Strathcona's Horse (Royal Canadians), R.C.A.C.	228	2270333	TURNER		1887	1918	
227				15		UN	/ww1/ww1176.jpg	27874	0	2800	ST. SEVER CEMETERY EXTENSION (ROUEN)	ANNEXE DU CIMETIÈRE DE ST-SEVER (ROUEN)			2	France	France				21					15			1	Army	Armée	PHILIP	O. II. D. 1.	P	276	Seine-Maritime	<p>The St. Sever Cemetery and Extension (Rouen) is situated about 3 kilometres south of Rouen Cathedral and a short distance west of the road from Rouen to Elbeuf.  If travelling from Elbeuf or Caen on the N.138, follow Avenue Des Canadiens right down to the roundabout.  Then take the fourth exit into Rue Stanislas De Jardin, and the cemetery lies 150 metres on the left.  The CWGC signpost is located at the entrance of the cemetery.  The cemetery covers an area of 49,885 square metres.</p><p>The War Stone is on the boundary of the original Cemetery and the Extension, facing the City of Rouen War Memorial. The Cross is raised on a terrace on the further side of the Extension. The Chapel, cruciform and surmounted by a dome, is in the middle of the Extension.</p>	<p>Le cimetière et l'annexe de St-Sever (Rouen) sont situés à environ 3 kilomètres au sud de la cathédrale de Rouen et à quelque distance de la route allant de Rouen à Elbeuf, en direction ouest.  En venant d'Elbeuf  ou Caen sur la route N138, suivez l'avenue des Canadiens jusqu'au carrefour giratoire. Prenez la quatrième sortie pour vous rendre sur la rue Stanislas-de-Jardin, et le cimetière se trouve sur la gauche, à 150 mètres.  Le panneau de la Commission des sépultures de guerre du Commonwealth se trouve à l'entrée du cimetière.  Le cimetière a une superficie de 49 885 mètres carrés.</p><p>La pierre commémorative se trouve à la limite du vieux cimetière et de la nouvelle partie, en face du Monument aux morts de la ville de Rouen. La Croix se dresse sur une terrasse, du côté de la nouvelle partie. La chapelle, cruciforme et surmontée d'une coupole, se trouve au milieu de la nouvelle partie.</p>		11		2800.gif	996	Driver	Conducteur	284	Canadian Field Artillery	Artillerie canadienne de campagne	229	307726	VAN AUDENARDE	10th Bde.		1916	
228	Son of Ed and Maria Dawson Van Gestel, of Avenue Elisabeth, 2, Aerschot, Brabant, Belgium.	Fils de Ed et Maria Dawson Van Gestel, de Avenue Elisabeth, 2, Aerschot, Brabant, Belgique.	26	15		UN	/ww1/ww1516.jpg	27875	0	2800	ST. SEVER CEMETERY EXTENSION (ROUEN)	ANNEXE DU CIMETIÈRE DE ST-SEVER (ROUEN)			2	France	France				15					15			1	Army	Armée	GEORGE	R. III. E. 10.	G	276	Seine-Maritime	<p>The St. Sever Cemetery and Extension (Rouen) is situated about 3 kilometres south of Rouen Cathedral and a short distance west of the road from Rouen to Elbeuf.  If travelling from Elbeuf or Caen on the N.138, follow Avenue Des Canadiens right down to the roundabout.  Then take the fourth exit into Rue Stanislas De Jardin, and the cemetery lies 150 metres on the left.  The CWGC signpost is located at the entrance of the cemetery.  The cemetery covers an area of 49,885 square metres.</p><p>The War Stone is on the boundary of the original Cemetery and the Extension, facing the City of Rouen War Memorial. The Cross is raised on a terrace on the further side of the Extension. The Chapel, cruciform and surmounted by a dome, is in the middle of the Extension.</p>	<p>Le cimetière et l'annexe de St-Sever (Rouen) sont situés à environ 3 kilomètres au sud de la cathédrale de Rouen et à quelque distance de la route allant de Rouen à Elbeuf, en direction ouest.  En venant d'Elbeuf  ou Caen sur la route N138, suivez l'avenue des Canadiens jusqu'au carrefour giratoire. Prenez la quatrième sortie pour vous rendre sur la rue Stanislas-de-Jardin, et le cimetière se trouve sur la gauche, à 150 mètres.  Le panneau de la Commission des sépultures de guerre du Commonwealth se trouve à l'entrée du cimetière.  Le cimetière a une superficie de 49 885 mètres carrés.</p><p>La pierre commémorative se trouve à la limite du vieux cimetière et de la nouvelle partie, en face du Monument aux morts de la ville de Rouen. La Croix se dresse sur une terrasse, du côté de la nouvelle partie. La chapelle, cruciforme et surmontée d'une coupole, se trouve au milieu de la nouvelle partie.</p>		09		2800.gif	1900	Private	Soldat	301	Canadian Machine Gun Corps	Corps des mitrailleurs canadiens	230	449	VAN GESTEL	2nd Bn.		1918	
229				15		UN	/ww1/ww1516.jpg	27876	0	2800	ST. SEVER CEMETERY EXTENSION (ROUEN)	ANNEXE DU CIMETIÈRE DE ST-SEVER (ROUEN)			2	France	France				01					15			1	Army	Armée	MICHAEL	S. II. JJ. 9.	M	276	Seine-Maritime	<p>The St. Sever Cemetery and Extension (Rouen) is situated about 3 kilometres south of Rouen Cathedral and a short distance west of the road from Rouen to Elbeuf.  If travelling from Elbeuf or Caen on the N.138, follow Avenue Des Canadiens right down to the roundabout.  Then take the fourth exit into Rue Stanislas De Jardin, and the cemetery lies 150 metres on the left.  The CWGC signpost is located at the entrance of the cemetery.  The cemetery covers an area of 49,885 square metres.</p><p>The War Stone is on the boundary of the original Cemetery and the Extension, facing the City of Rouen War Memorial. The Cross is raised on a terrace on the further side of the Extension. The Chapel, cruciform and surmounted by a dome, is in the middle of the Extension.</p>	<p>Le cimetière et l'annexe de St-Sever (Rouen) sont situés à environ 3 kilomètres au sud de la cathédrale de Rouen et à quelque distance de la route allant de Rouen à Elbeuf, en direction ouest.  En venant d'Elbeuf  ou Caen sur la route N138, suivez l'avenue des Canadiens jusqu'au carrefour giratoire. Prenez la quatrième sortie pour vous rendre sur la rue Stanislas-de-Jardin, et le cimetière se trouve sur la gauche, à 150 mètres.  Le panneau de la Commission des sépultures de guerre du Commonwealth se trouve à l'entrée du cimetière.  Le cimetière a une superficie de 49 885 mètres carrés.</p><p>La pierre commémorative se trouve à la limite du vieux cimetière et de la nouvelle partie, en face du Monument aux morts de la ville de Rouen. La Croix se dresse sur une terrasse, du côté de la nouvelle partie. La chapelle, cruciforme et surmontée d'une coupole, se trouve au milieu de la nouvelle partie.</p>		11		2800.gif	1900	Private	Soldat	285	Canadian Forestry Corps	Corps forestier canadien	231	916430	VASILIACHUK	48th Coy.		1918	
230	Son of John Melvin Vincent and Isabel Vincent; husband of Camilla Jane Vincent, of 136, Barnsdale Avenue North, Hamilton, Ontario.	Fils de John Melvin Vincent et Isabel Vincent; époux de Camilla Jane Vincent, de 136, Barnsdale Avenue North, Hamilton, Ontario.	32	15		UN	/ww1/ww1516.jpg	27877	0	2800	ST. SEVER CEMETERY EXTENSION (ROUEN)	ANNEXE DU CIMETIÈRE DE ST-SEVER (ROUEN)			2	France	France	1886-09-05 00:00:00.0		05	26					15			1	Army	Armée	JOHN MELVIN	S. III. K. 13.	J M	276	Seine-Maritime	<p>The St. Sever Cemetery and Extension (Rouen) is situated about 3 kilometres south of Rouen Cathedral and a short distance west of the road from Rouen to Elbeuf.  If travelling from Elbeuf or Caen on the N.138, follow Avenue Des Canadiens right down to the roundabout.  Then take the fourth exit into Rue Stanislas De Jardin, and the cemetery lies 150 metres on the left.  The CWGC signpost is located at the entrance of the cemetery.  The cemetery covers an area of 49,885 square metres.</p><p>The War Stone is on the boundary of the original Cemetery and the Extension, facing the City of Rouen War Memorial. The Cross is raised on a terrace on the further side of the Extension. The Chapel, cruciform and surmounted by a dome, is in the middle of the Extension.</p>	<p>Le cimetière et l'annexe de St-Sever (Rouen) sont situés à environ 3 kilomètres au sud de la cathédrale de Rouen et à quelque distance de la route allant de Rouen à Elbeuf, en direction ouest.  En venant d'Elbeuf  ou Caen sur la route N138, suivez l'avenue des Canadiens jusqu'au carrefour giratoire. Prenez la quatrième sortie pour vous rendre sur la rue Stanislas-de-Jardin, et le cimetière se trouve sur la gauche, à 150 mètres.  Le panneau de la Commission des sépultures de guerre du Commonwealth se trouve à l'entrée du cimetière.  Le cimetière a une superficie de 49 885 mètres carrés.</p><p>La pierre commémorative se trouve à la limite du vieux cimetière et de la nouvelle partie, en face du Monument aux morts de la ville de Rouen. La Croix se dresse sur une terrasse, du côté de la nouvelle partie. La chapelle, cruciforme et surmontée d'une coupole, se trouve au milieu de la nouvelle partie.</p>	09	11		2800.gif	2075	Sapper	Sapeur	311	Canadian Railway Troops	Troupes ferroviaires canadiennes	232	865257	VINCENT	2nd Bn.	1886	1918	
231	Son of Frederick and Mary Viney.	Fils de Frederick et Mary Viney.	24	15		UN	/ww1/ww1343.jpg	27878	0	2800	ST. SEVER CEMETERY EXTENSION (ROUEN)	ANNEXE DU CIMETIÈRE DE ST-SEVER (ROUEN)			2	France	France	1895-12-21 00:00:00.0		21	04					15			1	Army	Armée	ARTHUR FREDERICK	P. III. N. 45.	A F	276	Seine-Maritime	<p>The St. Sever Cemetery and Extension (Rouen) is situated about 3 kilometres south of Rouen Cathedral and a short distance west of the road from Rouen to Elbeuf.  If travelling from Elbeuf or Caen on the N.138, follow Avenue Des Canadiens right down to the roundabout.  Then take the fourth exit into Rue Stanislas De Jardin, and the cemetery lies 150 metres on the left.  The CWGC signpost is located at the entrance of the cemetery.  The cemetery covers an area of 49,885 square metres.</p><p>The War Stone is on the boundary of the original Cemetery and the Extension, facing the City of Rouen War Memorial. The Cross is raised on a terrace on the further side of the Extension. The Chapel, cruciform and surmounted by a dome, is in the middle of the Extension.</p>	<p>Le cimetière et l'annexe de St-Sever (Rouen) sont situés à environ 3 kilomètres au sud de la cathédrale de Rouen et à quelque distance de la route allant de Rouen à Elbeuf, en direction ouest.  En venant d'Elbeuf  ou Caen sur la route N138, suivez l'avenue des Canadiens jusqu'au carrefour giratoire. Prenez la quatrième sortie pour vous rendre sur la rue Stanislas-de-Jardin, et le cimetière se trouve sur la gauche, à 150 mètres.  Le panneau de la Commission des sépultures de guerre du Commonwealth se trouve à l'entrée du cimetière.  Le cimetière a une superficie de 49 885 mètres carrés.</p><p>La pierre commémorative se trouve à la limite du vieux cimetière et de la nouvelle partie, en face du Monument aux morts de la ville de Rouen. La Croix se dresse sur une terrasse, du côté de la nouvelle partie. La chapelle, cruciforme et surmontée d'une coupole, se trouve au milieu de la nouvelle partie.</p>	12	11		2800.gif	1900	Private	Soldat	1164	Canadian Infantry (Manitoba Regiment)		233	700959	VINEY	43rd Bn.	1895	1917	
232	Son of Richard and Annie Walker, of Culkerton, Tetbury, England,	Fils de Richard et Annie Walker, de Culkerton, Tetbury, Angleterre,	25	15		UN	/ww1/ww1517.jpg	27879	0	2800	ST. SEVER CEMETERY EXTENSION (ROUEN)	ANNEXE DU CIMETIÈRE DE ST-SEVER (ROUEN)			2	France	France	1891-11-22 00:00:00.0		22	12					15			1	Army	Armée	EVAN	P. IX. H. 1A.	E	276	Seine-Maritime	<p>The St. Sever Cemetery and Extension (Rouen) is situated about 3 kilometres south of Rouen Cathedral and a short distance west of the road from Rouen to Elbeuf.  If travelling from Elbeuf or Caen on the N.138, follow Avenue Des Canadiens right down to the roundabout.  Then take the fourth exit into Rue Stanislas De Jardin, and the cemetery lies 150 metres on the left.  The CWGC signpost is located at the entrance of the cemetery.  The cemetery covers an area of 49,885 square metres.</p><p>The War Stone is on the boundary of the original Cemetery and the Extension, facing the City of Rouen War Memorial. The Cross is raised on a terrace on the further side of the Extension. The Chapel, cruciform and surmounted by a dome, is in the middle of the Extension.</p>	<p>Le cimetière et l'annexe de St-Sever (Rouen) sont situés à environ 3 kilomètres au sud de la cathédrale de Rouen et à quelque distance de la route allant de Rouen à Elbeuf, en direction ouest.  En venant d'Elbeuf  ou Caen sur la route N138, suivez l'avenue des Canadiens jusqu'au carrefour giratoire. Prenez la quatrième sortie pour vous rendre sur la rue Stanislas-de-Jardin, et le cimetière se trouve sur la gauche, à 150 mètres.  Le panneau de la Commission des sépultures de guerre du Commonwealth se trouve à l'entrée du cimetière.  Le cimetière a une superficie de 49 885 mètres carrés.</p><p>La pierre commémorative se trouve à la limite du vieux cimetière et de la nouvelle partie, en face du Monument aux morts de la ville de Rouen. La Croix se dresse sur une terrasse, du côté de la nouvelle partie. La chapelle, cruciforme et surmontée d'une coupole, se trouve au milieu de la nouvelle partie.</p>	11	04		2800.gif	1900	Private	Soldat	1816	Royal Canadian Dragoons (1<sup>st</sup> Armoured Regiment)		234	550084	WALKER		1891	1918	
233				15		UN	/ww1/ww1518.jpg	27880	0	2800	ST. SEVER CEMETERY EXTENSION (ROUEN)	ANNEXE DU CIMETIÈRE DE ST-SEVER (ROUEN)			2	France	France	1896-06-07 00:00:00.0		07	12					15			1	Army	Armée	JAMES RAYSON	Q. V. E. 7.	J R	276	Seine-Maritime	<p>The St. Sever Cemetery and Extension (Rouen) is situated about 3 kilometres south of Rouen Cathedral and a short distance west of the road from Rouen to Elbeuf.  If travelling from Elbeuf or Caen on the N.138, follow Avenue Des Canadiens right down to the roundabout.  Then take the fourth exit into Rue Stanislas De Jardin, and the cemetery lies 150 metres on the left.  The CWGC signpost is located at the entrance of the cemetery.  The cemetery covers an area of 49,885 square metres.</p><p>The War Stone is on the boundary of the original Cemetery and the Extension, facing the City of Rouen War Memorial. The Cross is raised on a terrace on the further side of the Extension. The Chapel, cruciform and surmounted by a dome, is in the middle of the Extension.</p>	<p>Le cimetière et l'annexe de St-Sever (Rouen) sont situés à environ 3 kilomètres au sud de la cathédrale de Rouen et à quelque distance de la route allant de Rouen à Elbeuf, en direction ouest.  En venant d'Elbeuf  ou Caen sur la route N138, suivez l'avenue des Canadiens jusqu'au carrefour giratoire. Prenez la quatrième sortie pour vous rendre sur la rue Stanislas-de-Jardin, et le cimetière se trouve sur la gauche, à 150 mètres.  Le panneau de la Commission des sépultures de guerre du Commonwealth se trouve à l'entrée du cimetière.  Le cimetière a une superficie de 49 885 mètres carrés.</p><p>La pierre commémorative se trouve à la limite du vieux cimetière et de la nouvelle partie, en face du Monument aux morts de la ville de Rouen. La Croix se dresse sur une terrasse, du côté de la nouvelle partie. La chapelle, cruciforme et surmontée d'une coupole, se trouve au milieu de la nouvelle partie.</p>	06	08		2800.gif	1900	Private	Soldat	304	2<sup>nd</sup> Canadian Mounted Rifles (British Columbia Regt.)		235	916642	WALLACE		1896	1918	
234	Stepson of Sarah E. Washington.	Beau-fils de Sarah E. Washington.	29	15		UN	/ww1/ww1519.jpg	27881	0	2800	ST. SEVER CEMETERY EXTENSION (ROUEN)	ANNEXE DU CIMETIÈRE DE ST-SEVER (ROUEN)			2	France	France	1888-03-08 00:00:00.0		08	25					15			1	Army	Armée	ROBERT	S. II. FF. 25.	R	276	Seine-Maritime	<p>The St. Sever Cemetery and Extension (Rouen) is situated about 3 kilometres south of Rouen Cathedral and a short distance west of the road from Rouen to Elbeuf.  If travelling from Elbeuf or Caen on the N.138, follow Avenue Des Canadiens right down to the roundabout.  Then take the fourth exit into Rue Stanislas De Jardin, and the cemetery lies 150 metres on the left.  The CWGC signpost is located at the entrance of the cemetery.  The cemetery covers an area of 49,885 square metres.</p><p>The War Stone is on the boundary of the original Cemetery and the Extension, facing the City of Rouen War Memorial. The Cross is raised on a terrace on the further side of the Extension. The Chapel, cruciform and surmounted by a dome, is in the middle of the Extension.</p>	<p>Le cimetière et l'annexe de St-Sever (Rouen) sont situés à environ 3 kilomètres au sud de la cathédrale de Rouen et à quelque distance de la route allant de Rouen à Elbeuf, en direction ouest.  En venant d'Elbeuf  ou Caen sur la route N138, suivez l'avenue des Canadiens jusqu'au carrefour giratoire. Prenez la quatrième sortie pour vous rendre sur la rue Stanislas-de-Jardin, et le cimetière se trouve sur la gauche, à 150 mètres.  Le panneau de la Commission des sépultures de guerre du Commonwealth se trouve à l'entrée du cimetière.  Le cimetière a une superficie de 49 885 mètres carrés.</p><p>La pierre commémorative se trouve à la limite du vieux cimetière et de la nouvelle partie, en face du Monument aux morts de la ville de Rouen. La Croix se dresse sur une terrasse, du côté de la nouvelle partie. La chapelle, cruciforme et surmontée d'une coupole, se trouve au milieu de la nouvelle partie.</p>	03	10		2800.gif	1900	Private	Soldat	301	Canadian Machine Gun Corps	Corps des mitrailleurs canadiens	236	7222	WASHINGTON	Cavalry Machine Gun Sqdn.	1888	1918	
235				15		UN	/ww1/ww1180.jpg	27882	0	2800	ST. SEVER CEMETERY EXTENSION (ROUEN)	ANNEXE DU CIMETIÈRE DE ST-SEVER (ROUEN)			2	France	France	1874-05-13 00:00:00.0		13	24					15			1	Army	Armée	JOSEPH	O. III. Q. 12.	J	276	Seine-Maritime	<p>The St. Sever Cemetery and Extension (Rouen) is situated about 3 kilometres south of Rouen Cathedral and a short distance west of the road from Rouen to Elbeuf.  If travelling from Elbeuf or Caen on the N.138, follow Avenue Des Canadiens right down to the roundabout.  Then take the fourth exit into Rue Stanislas De Jardin, and the cemetery lies 150 metres on the left.  The CWGC signpost is located at the entrance of the cemetery.  The cemetery covers an area of 49,885 square metres.</p><p>The War Stone is on the boundary of the original Cemetery and the Extension, facing the City of Rouen War Memorial. The Cross is raised on a terrace on the further side of the Extension. The Chapel, cruciform and surmounted by a dome, is in the middle of the Extension.</p>	<p>Le cimetière et l'annexe de St-Sever (Rouen) sont situés à environ 3 kilomètres au sud de la cathédrale de Rouen et à quelque distance de la route allant de Rouen à Elbeuf, en direction ouest.  En venant d'Elbeuf  ou Caen sur la route N138, suivez l'avenue des Canadiens jusqu'au carrefour giratoire. Prenez la quatrième sortie pour vous rendre sur la rue Stanislas-de-Jardin, et le cimetière se trouve sur la gauche, à 150 mètres.  Le panneau de la Commission des sépultures de guerre du Commonwealth se trouve à l'entrée du cimetière.  Le cimetière a une superficie de 49 885 mètres carrés.</p><p>La pierre commémorative se trouve à la limite du vieux cimetière et de la nouvelle partie, en face du Monument aux morts de la ville de Rouen. La Croix se dresse sur une terrasse, du côté de la nouvelle partie. La chapelle, cruciforme et surmontée d'une coupole, se trouve au milieu de la nouvelle partie.</p>	05	11		2800.gif	1900	Private	Soldat	337	Canadian Infantry (Central Ontario Regiment)		237	443643	WETHERELL	54th Bn.	1874	1916	
236				15		UN	/ww1/ww1181.jpg	27883	0	2800	ST. SEVER CEMETERY EXTENSION (ROUEN)	ANNEXE DU CIMETIÈRE DE ST-SEVER (ROUEN)			2	France	France	1892-01-27 00:00:00.0		27	29					15			1	Army	Armée	ERNEST	O. I. K. 6.	E	276	Seine-Maritime	<p>The St. Sever Cemetery and Extension (Rouen) is situated about 3 kilometres south of Rouen Cathedral and a short distance west of the road from Rouen to Elbeuf.  If travelling from Elbeuf or Caen on the N.138, follow Avenue Des Canadiens right down to the roundabout.  Then take the fourth exit into Rue Stanislas De Jardin, and the cemetery lies 150 metres on the left.  The CWGC signpost is located at the entrance of the cemetery.  The cemetery covers an area of 49,885 square metres.</p><p>The War Stone is on the boundary of the original Cemetery and the Extension, facing the City of Rouen War Memorial. The Cross is raised on a terrace on the further side of the Extension. The Chapel, cruciform and surmounted by a dome, is in the middle of the Extension.</p>	<p>Le cimetière et l'annexe de St-Sever (Rouen) sont situés à environ 3 kilomètres au sud de la cathédrale de Rouen et à quelque distance de la route allant de Rouen à Elbeuf, en direction ouest.  En venant d'Elbeuf  ou Caen sur la route N138, suivez l'avenue des Canadiens jusqu'au carrefour giratoire. Prenez la quatrième sortie pour vous rendre sur la rue Stanislas-de-Jardin, et le cimetière se trouve sur la gauche, à 150 mètres.  Le panneau de la Commission des sépultures de guerre du Commonwealth se trouve à l'entrée du cimetière.  Le cimetière a une superficie de 49 885 mètres carrés.</p><p>La pierre commémorative se trouve à la limite du vieux cimetière et de la nouvelle partie, en face du Monument aux morts de la ville de Rouen. La Croix se dresse sur une terrasse, du côté de la nouvelle partie. La chapelle, cruciforme et surmontée d'une coupole, se trouve au milieu de la nouvelle partie.</p>	01	10		2800.gif	1407	Lance Corporal	Caporal suppléant	337	Canadian Infantry (Central Ontario Regiment)		238	703783	WHETTELL	102nd Bn.	1892	1916	
237				15		UN	/ww1/ww1521.jpg	27885	0	2800	ST. SEVER CEMETERY EXTENSION (ROUEN)	ANNEXE DU CIMETIÈRE DE ST-SEVER (ROUEN)			2	France	France	1896-12-09 00:00:00.0		09	07					15			1	Army	Armée	JAMES HENRY	S. II. I. 4.	J H	276	Seine-Maritime	<p>The St. Sever Cemetery and Extension (Rouen) is situated about 3 kilometres south of Rouen Cathedral and a short distance west of the road from Rouen to Elbeuf.  If travelling from Elbeuf or Caen on the N.138, follow Avenue Des Canadiens right down to the roundabout.  Then take the fourth exit into Rue Stanislas De Jardin, and the cemetery lies 150 metres on the left.  The CWGC signpost is located at the entrance of the cemetery.  The cemetery covers an area of 49,885 square metres.</p><p>The War Stone is on the boundary of the original Cemetery and the Extension, facing the City of Rouen War Memorial. The Cross is raised on a terrace on the further side of the Extension. The Chapel, cruciform and surmounted by a dome, is in the middle of the Extension.</p>	<p>Le cimetière et l'annexe de St-Sever (Rouen) sont situés à environ 3 kilomètres au sud de la cathédrale de Rouen et à quelque distance de la route allant de Rouen à Elbeuf, en direction ouest.  En venant d'Elbeuf  ou Caen sur la route N138, suivez l'avenue des Canadiens jusqu'au carrefour giratoire. Prenez la quatrième sortie pour vous rendre sur la rue Stanislas-de-Jardin, et le cimetière se trouve sur la gauche, à 150 mètres.  Le panneau de la Commission des sépultures de guerre du Commonwealth se trouve à l'entrée du cimetière.  Le cimetière a une superficie de 49 885 mètres carrés.</p><p>La pierre commémorative se trouve à la limite du vieux cimetière et de la nouvelle partie, en face du Monument aux morts de la ville de Rouen. La Croix se dresse sur une terrasse, du côté de la nouvelle partie. La chapelle, cruciforme et surmontée d'une coupole, se trouve au milieu de la nouvelle partie.</p>	12	10		2800.gif	1900	Private	Soldat	337	Canadian Infantry (Central Ontario Regiment)		239	730719	WHITE	75th Bn.	1896	1918	
