121				15		UN	/ww1/ww1463.jpg	27769	0	2800	ST. SEVER CEMETERY EXTENSION (ROUEN)	ANNEXE DU CIMETIÈRE DE ST-SEVER (ROUEN)			2	France	France	1893-09-20 00:00:00.0		20	16					15			1	Army	Armée	JOHN ARCHIBALD	R. 11. F. 3.	J A	276	Seine-Maritime	<p>The St. Sever Cemetery and Extension (Rouen) is situated about 3 kilometres south of Rouen Cathedral and a short distance west of the road from Rouen to Elbeuf.  If travelling from Elbeuf or Caen on the N.138, follow Avenue Des Canadiens right down to the roundabout.  Then take the fourth exit into Rue Stanislas De Jardin, and the cemetery lies 150 metres on the left.  The CWGC signpost is located at the entrance of the cemetery.  The cemetery covers an area of 49,885 square metres.</p><p>The War Stone is on the boundary of the original Cemetery and the Extension, facing the City of Rouen War Memorial. The Cross is raised on a terrace on the further side of the Extension. The Chapel, cruciform and surmounted by a dome, is in the middle of the Extension.</p>	<p>Le cimetière et l'annexe de St-Sever (Rouen) sont situés à environ 3 kilomètres au sud de la cathédrale de Rouen et à quelque distance de la route allant de Rouen à Elbeuf, en direction ouest.  En venant d'Elbeuf  ou Caen sur la route N138, suivez l'avenue des Canadiens jusqu'au carrefour giratoire. Prenez la quatrième sortie pour vous rendre sur la rue Stanislas-de-Jardin, et le cimetière se trouve sur la gauche, à 150 mètres.  Le panneau de la Commission des sépultures de guerre du Commonwealth se trouve à l'entrée du cimetière.  Le cimetière a une superficie de 49 885 mètres carrés.</p><p>La pierre commémorative se trouve à la limite du vieux cimetière et de la nouvelle partie, en face du Monument aux morts de la ville de Rouen. La Croix se dresse sur une terrasse, du côté de la nouvelle partie. La chapelle, cruciforme et surmontée d'une coupole, se trouve au milieu de la nouvelle partie.</p>	09	08		2800.gif	1900	Private	Soldat	2012	Canadian Infantry (Saskatchewan Regiment)		123	1743	MACLEOD	5th Bn.	1893	1918	
122	Son of William and Esther McNee, of Wavertree, Liverpool, England.	Fils de William et Esther McNee, de Wavertree, Liverpool, Angleterre.	37	15		UN	/ww1/ww1464.jpg	27770	0	2800	ST. SEVER CEMETERY EXTENSION (ROUEN)	ANNEXE DU CIMETIÈRE DE ST-SEVER (ROUEN)			2	France	France	1880-10-02 00:00:00.0		02	12		1		UN	15		UN	1	Army	Armée	JAMES	P. XI. G. 65.	J	276	Seine-Maritime	<p>The St. Sever Cemetery and Extension (Rouen) is situated about 3 kilometres south of Rouen Cathedral and a short distance west of the road from Rouen to Elbeuf.  If travelling from Elbeuf or Caen on the N.138, follow Avenue Des Canadiens right down to the roundabout.  Then take the fourth exit into Rue Stanislas De Jardin, and the cemetery lies 150 metres on the left.  The CWGC signpost is located at the entrance of the cemetery.  The cemetery covers an area of 49,885 square metres.</p><p>The War Stone is on the boundary of the original Cemetery and the Extension, facing the City of Rouen War Memorial. The Cross is raised on a terrace on the further side of the Extension. The Chapel, cruciform and surmounted by a dome, is in the middle of the Extension.</p>	<p>Le cimetière et l'annexe de St-Sever (Rouen) sont situés à environ 3 kilomètres au sud de la cathédrale de Rouen et à quelque distance de la route allant de Rouen à Elbeuf, en direction ouest.  En venant d'Elbeuf  ou Caen sur la route N138, suivez l'avenue des Canadiens jusqu'au carrefour giratoire. Prenez la quatrième sortie pour vous rendre sur la rue Stanislas-de-Jardin, et le cimetière se trouve sur la gauche, à 150 mètres.  Le panneau de la Commission des sépultures de guerre du Commonwealth se trouve à l'entrée du cimetière.  Le cimetière a une superficie de 49 885 mètres carrés.</p><p>La pierre commémorative se trouve à la limite du vieux cimetière et de la nouvelle partie, en face du Monument aux morts de la ville de Rouen. La Croix se dresse sur une terrasse, du côté de la nouvelle partie. La chapelle, cruciforme et surmontée d'une coupole, se trouve au milieu de la nouvelle partie.</p>	10	05		2800.gif	1900	Private	Soldat	2012	Canadian Infantry (Saskatchewan Regiment)		124	925787	MCNEE	28th Bn.	1880	1918	
123				15		UN	/ww1/ww1464.jpg	27771	0	2800	ST. SEVER CEMETERY EXTENSION (ROUEN)	ANNEXE DU CIMETIÈRE DE ST-SEVER (ROUEN)			2	France	France	1879-02-15 00:00:00.0		15	11					15			1	Army	Armée	ALEXANDER	P. XI. G. 10B.	A	276	Seine-Maritime	<p>The St. Sever Cemetery and Extension (Rouen) is situated about 3 kilometres south of Rouen Cathedral and a short distance west of the road from Rouen to Elbeuf.  If travelling from Elbeuf or Caen on the N.138, follow Avenue Des Canadiens right down to the roundabout.  Then take the fourth exit into Rue Stanislas De Jardin, and the cemetery lies 150 metres on the left.  The CWGC signpost is located at the entrance of the cemetery.  The cemetery covers an area of 49,885 square metres.</p><p>The War Stone is on the boundary of the original Cemetery and the Extension, facing the City of Rouen War Memorial. The Cross is raised on a terrace on the further side of the Extension. The Chapel, cruciform and surmounted by a dome, is in the middle of the Extension.</p>	<p>Le cimetière et l'annexe de St-Sever (Rouen) sont situés à environ 3 kilomètres au sud de la cathédrale de Rouen et à quelque distance de la route allant de Rouen à Elbeuf, en direction ouest.  En venant d'Elbeuf  ou Caen sur la route N138, suivez l'avenue des Canadiens jusqu'au carrefour giratoire. Prenez la quatrième sortie pour vous rendre sur la rue Stanislas-de-Jardin, et le cimetière se trouve sur la gauche, à 150 mètres.  Le panneau de la Commission des sépultures de guerre du Commonwealth se trouve à l'entrée du cimetière.  Le cimetière a une superficie de 49 885 mètres carrés.</p><p>La pierre commémorative se trouve à la limite du vieux cimetière et de la nouvelle partie, en face du Monument aux morts de la ville de Rouen. La Croix se dresse sur une terrasse, du côté de la nouvelle partie. La chapelle, cruciforme et surmontée d'une coupole, se trouve au milieu de la nouvelle partie.</p>	02	05		2800.gif	1900	Private	Soldat	337	Canadian Infantry (Central Ontario Regiment)		125	1045290	MCPHERSON	15th Bn.	1879	1918	
124				15		UN	/ww1/ww1464.jpg	27772	0	2800	ST. SEVER CEMETERY EXTENSION (ROUEN)	ANNEXE DU CIMETIÈRE DE ST-SEVER (ROUEN)			2	France	France	1891-07-01 00:00:00.0		01	16					15			1	Army	Armée	DONALD	R. II. I. 7.	D	276	Seine-Maritime	<p>The St. Sever Cemetery and Extension (Rouen) is situated about 3 kilometres south of Rouen Cathedral and a short distance west of the road from Rouen to Elbeuf.  If travelling from Elbeuf or Caen on the N.138, follow Avenue Des Canadiens right down to the roundabout.  Then take the fourth exit into Rue Stanislas De Jardin, and the cemetery lies 150 metres on the left.  The CWGC signpost is located at the entrance of the cemetery.  The cemetery covers an area of 49,885 square metres.</p><p>The War Stone is on the boundary of the original Cemetery and the Extension, facing the City of Rouen War Memorial. The Cross is raised on a terrace on the further side of the Extension. The Chapel, cruciform and surmounted by a dome, is in the middle of the Extension.</p>	<p>Le cimetière et l'annexe de St-Sever (Rouen) sont situés à environ 3 kilomètres au sud de la cathédrale de Rouen et à quelque distance de la route allant de Rouen à Elbeuf, en direction ouest.  En venant d'Elbeuf  ou Caen sur la route N138, suivez l'avenue des Canadiens jusqu'au carrefour giratoire. Prenez la quatrième sortie pour vous rendre sur la rue Stanislas-de-Jardin, et le cimetière se trouve sur la gauche, à 150 mètres.  Le panneau de la Commission des sépultures de guerre du Commonwealth se trouve à l'entrée du cimetière.  Le cimetière a une superficie de 49 885 mètres carrés.</p><p>La pierre commémorative se trouve à la limite du vieux cimetière et de la nouvelle partie, en face du Monument aux morts de la ville de Rouen. La Croix se dresse sur une terrasse, du côté de la nouvelle partie. La chapelle, cruciforme et surmontée d'une coupole, se trouve au milieu de la nouvelle partie.</p>	07	08		2800.gif	1417	Lance Serjeant	Sergent suppléant	1164	Canadian Infantry (Manitoba Regiment)		126	77092	MACPHERSON	16th Bn.	1891	1918	
125	Son of Norman McRitchie, of Washabuck Bridge, Victoria Co., Nova Scotia.	Fils de Norman McRitchie, de Washabuck Bridge, comté de Victoria, Nouvelle-Écosse.	29	15		UN	/ww1/ww1465.jpg	27773	0	2800	ST. SEVER CEMETERY EXTENSION (ROUEN)	ANNEXE DU CIMETIÈRE DE ST-SEVER (ROUEN)			2	France	France				15					15			1	Army	Armée	DANIEL MADISON	P. XI. N. 3B.	D M	276	Seine-Maritime	<p>The St. Sever Cemetery and Extension (Rouen) is situated about 3 kilometres south of Rouen Cathedral and a short distance west of the road from Rouen to Elbeuf.  If travelling from Elbeuf or Caen on the N.138, follow Avenue Des Canadiens right down to the roundabout.  Then take the fourth exit into Rue Stanislas De Jardin, and the cemetery lies 150 metres on the left.  The CWGC signpost is located at the entrance of the cemetery.  The cemetery covers an area of 49,885 square metres.</p><p>The War Stone is on the boundary of the original Cemetery and the Extension, facing the City of Rouen War Memorial. The Cross is raised on a terrace on the further side of the Extension. The Chapel, cruciform and surmounted by a dome, is in the middle of the Extension.</p>	<p>Le cimetière et l'annexe de St-Sever (Rouen) sont situés à environ 3 kilomètres au sud de la cathédrale de Rouen et à quelque distance de la route allant de Rouen à Elbeuf, en direction ouest.  En venant d'Elbeuf  ou Caen sur la route N138, suivez l'avenue des Canadiens jusqu'au carrefour giratoire. Prenez la quatrième sortie pour vous rendre sur la rue Stanislas-de-Jardin, et le cimetière se trouve sur la gauche, à 150 mètres.  Le panneau de la Commission des sépultures de guerre du Commonwealth se trouve à l'entrée du cimetière.  Le cimetière a une superficie de 49 885 mètres carrés.</p><p>La pierre commémorative se trouve à la limite du vieux cimetière et de la nouvelle partie, en face du Monument aux morts de la ville de Rouen. La Croix se dresse sur une terrasse, du côté de la nouvelle partie. La chapelle, cruciforme et surmontée d'une coupole, se trouve au milieu de la nouvelle partie.</p>		04		2800.gif	1407	Lance Corporal	Caporal suppléant	235	Lord Strathcona's Horse (Royal Canadians), R.C.A.C.	Lord Strathcona's Horse (Royal Canadians), R.C.A.C.	127	2556	MACRITCHIE			1918	
126	Son of Samuel and Sara Whiteside Magill, of Larne, Co. Antrim, Ireland.	Fils de Samuel et Sara Whiteside Magill, de Larne, Co. Antrim, Irlande.	23	15		UN	/ww1/ww1466.jpg	27774	0	2800	ST. SEVER CEMETERY EXTENSION (ROUEN)	ANNEXE DU CIMETIÈRE DE ST-SEVER (ROUEN)			2	France	France	1895-03-13 00:00:00.0		13	06					15			1	Army	Armée	HERBERT THOMAS FERGUSON	P. IX. F. 13A.	H T F	276	Seine-Maritime	<p>The St. Sever Cemetery and Extension (Rouen) is situated about 3 kilometres south of Rouen Cathedral and a short distance west of the road from Rouen to Elbeuf.  If travelling from Elbeuf or Caen on the N.138, follow Avenue Des Canadiens right down to the roundabout.  Then take the fourth exit into Rue Stanislas De Jardin, and the cemetery lies 150 metres on the left.  The CWGC signpost is located at the entrance of the cemetery.  The cemetery covers an area of 49,885 square metres.</p><p>The War Stone is on the boundary of the original Cemetery and the Extension, facing the City of Rouen War Memorial. The Cross is raised on a terrace on the further side of the Extension. The Chapel, cruciform and surmounted by a dome, is in the middle of the Extension.</p>	<p>Le cimetière et l'annexe de St-Sever (Rouen) sont situés à environ 3 kilomètres au sud de la cathédrale de Rouen et à quelque distance de la route allant de Rouen à Elbeuf, en direction ouest.  En venant d'Elbeuf  ou Caen sur la route N138, suivez l'avenue des Canadiens jusqu'au carrefour giratoire. Prenez la quatrième sortie pour vous rendre sur la rue Stanislas-de-Jardin, et le cimetière se trouve sur la gauche, à 150 mètres.  Le panneau de la Commission des sépultures de guerre du Commonwealth se trouve à l'entrée du cimetière.  Le cimetière a une superficie de 49 885 mètres carrés.</p><p>La pierre commémorative se trouve à la limite du vieux cimetière et de la nouvelle partie, en face du Monument aux morts de la ville de Rouen. La Croix se dresse sur une terrasse, du côté de la nouvelle partie. La chapelle, cruciforme et surmontée d'une coupole, se trouve au milieu de la nouvelle partie.</p>	03	04		2800.gif	1900	Private	Soldat	235	Lord Strathcona's Horse (Royal Canadians), R.C.A.C.	Lord Strathcona's Horse (Royal Canadians), R.C.A.C.	128	2270336	MAGILL		1895	1918	
127			21	15		UN	/ww1/ww1466.jpg	27775	0	2800	ST. SEVER CEMETERY EXTENSION (ROUEN)	ANNEXE DU CIMETIÈRE DE ST-SEVER (ROUEN)			2	France	France	1897-07-15 00:00:00.0		15	10		1		UN	15		UN	1	Army	Armée	FRED	S. 11.	F	276	Seine-Maritime	<p>The St. Sever Cemetery and Extension (Rouen) is situated about 3 kilometres south of Rouen Cathedral and a short distance west of the road from Rouen to Elbeuf.  If travelling from Elbeuf or Caen on the N.138, follow Avenue Des Canadiens right down to the roundabout.  Then take the fourth exit into Rue Stanislas De Jardin, and the cemetery lies 150 metres on the left.  The CWGC signpost is located at the entrance of the cemetery.  The cemetery covers an area of 49,885 square metres.</p><p>The War Stone is on the boundary of the original Cemetery and the Extension, facing the City of Rouen War Memorial. The Cross is raised on a terrace on the further side of the Extension. The Chapel, cruciform and surmounted by a dome, is in the middle of the Extension.</p>	<p>Le cimetière et l'annexe de St-Sever (Rouen) sont situés à environ 3 kilomètres au sud de la cathédrale de Rouen et à quelque distance de la route allant de Rouen à Elbeuf, en direction ouest.  En venant d'Elbeuf  ou Caen sur la route N138, suivez l'avenue des Canadiens jusqu'au carrefour giratoire. Prenez la quatrième sortie pour vous rendre sur la rue Stanislas-de-Jardin, et le cimetière se trouve sur la gauche, à 150 mètres.  Le panneau de la Commission des sépultures de guerre du Commonwealth se trouve à l'entrée du cimetière.  Le cimetière a une superficie de 49 885 mètres carrés.</p><p>La pierre commémorative se trouve à la limite du vieux cimetière et de la nouvelle partie, en face du Monument aux morts de la ville de Rouen. La Croix se dresse sur une terrasse, du côté de la nouvelle partie. La chapelle, cruciforme et surmontée d'une coupole, se trouve au milieu de la nouvelle partie.</p>	07	10		2800.gif	1900	Private	Soldat	1290	Canadian Infantry (Nova Scotia Regiment)		129	132588	MANCHIP	85th Bn.	1897	1918	
128				15		UN	/ww1/ww1132.jpg	27776	0	2800	ST. SEVER CEMETERY EXTENSION (ROUEN)	ANNEXE DU CIMETIÈRE DE ST-SEVER (ROUEN)			2	France	France	1890-08-24 00:00:00.0		24	04					15			1	Army	Armée	JAMES	O. I. D. 2.	J	276	Seine-Maritime	<p>The St. Sever Cemetery and Extension (Rouen) is situated about 3 kilometres south of Rouen Cathedral and a short distance west of the road from Rouen to Elbeuf.  If travelling from Elbeuf or Caen on the N.138, follow Avenue Des Canadiens right down to the roundabout.  Then take the fourth exit into Rue Stanislas De Jardin, and the cemetery lies 150 metres on the left.  The CWGC signpost is located at the entrance of the cemetery.  The cemetery covers an area of 49,885 square metres.</p><p>The War Stone is on the boundary of the original Cemetery and the Extension, facing the City of Rouen War Memorial. The Cross is raised on a terrace on the further side of the Extension. The Chapel, cruciform and surmounted by a dome, is in the middle of the Extension.</p>	<p>Le cimetière et l'annexe de St-Sever (Rouen) sont situés à environ 3 kilomètres au sud de la cathédrale de Rouen et à quelque distance de la route allant de Rouen à Elbeuf, en direction ouest.  En venant d'Elbeuf  ou Caen sur la route N138, suivez l'avenue des Canadiens jusqu'au carrefour giratoire. Prenez la quatrième sortie pour vous rendre sur la rue Stanislas-de-Jardin, et le cimetière se trouve sur la gauche, à 150 mètres.  Le panneau de la Commission des sépultures de guerre du Commonwealth se trouve à l'entrée du cimetière.  Le cimetière a une superficie de 49 885 mètres carrés.</p><p>La pierre commémorative se trouve à la limite du vieux cimetière et de la nouvelle partie, en face du Monument aux morts de la ville de Rouen. La Croix se dresse sur une terrasse, du côté de la nouvelle partie. La chapelle, cruciforme et surmontée d'une coupole, se trouve au milieu de la nouvelle partie.</p>	08	11		2800.gif	1900	Private	Soldat	15	Canadian Infantry (Alberta Regiment)		130	220154	MARA	50th Bn.	1890	1916	
129	Son of Benjamin Thomas and Phoebe Marchbank, of Nottingham, England. Went to Canada at the age of 15. Enlisted 1915.	Fils de Benjamin Thomas et Phoebe Marchbank, de II, Burford Rd., Nottingham, Angleterre. Il est allé au Canada à l'âge de 15 ans et s'est engagé en 1915.	22	15		UN	/ww1/ww1467.jpg	27777	0	2800	ST. SEVER CEMETERY EXTENSION (ROUEN)	ANNEXE DU CIMETIÈRE DE ST-SEVER (ROUEN)			2	France	France	1894-01-03 00:00:00.0		03	28		1		UN	15		UN	1	Army	Armée	LESLIE DALE	P. XI. H. 11A.	L D	276	Seine-Maritime	<p>The St. Sever Cemetery and Extension (Rouen) is situated about 3 kilometres south of Rouen Cathedral and a short distance west of the road from Rouen to Elbeuf.  If travelling from Elbeuf or Caen on the N.138, follow Avenue Des Canadiens right down to the roundabout.  Then take the fourth exit into Rue Stanislas De Jardin, and the cemetery lies 150 metres on the left.  The CWGC signpost is located at the entrance of the cemetery.  The cemetery covers an area of 49,885 square metres.</p><p>The War Stone is on the boundary of the original Cemetery and the Extension, facing the City of Rouen War Memorial. The Cross is raised on a terrace on the further side of the Extension. The Chapel, cruciform and surmounted by a dome, is in the middle of the Extension.</p>	<p>Le cimetière et l'annexe de St-Sever (Rouen) sont situés à environ 3 kilomètres au sud de la cathédrale de Rouen et à quelque distance de la route allant de Rouen à Elbeuf, en direction ouest.  En venant d'Elbeuf  ou Caen sur la route N138, suivez l'avenue des Canadiens jusqu'au carrefour giratoire. Prenez la quatrième sortie pour vous rendre sur la rue Stanislas-de-Jardin, et le cimetière se trouve sur la gauche, à 150 mètres.  Le panneau de la Commission des sépultures de guerre du Commonwealth se trouve à l'entrée du cimetière.  Le cimetière a une superficie de 49 885 mètres carrés.</p><p>La pierre commémorative se trouve à la limite du vieux cimetière et de la nouvelle partie, en face du Monument aux morts de la ville de Rouen. La Croix se dresse sur une terrasse, du côté de la nouvelle partie. La chapelle, cruciforme et surmontée d'une coupole, se trouve au milieu de la nouvelle partie.</p>	01	04		2800.gif	1407	Lance Corporal	Caporal suppléant	502	The Fort Garry Horse		131	114127	MARCHBANK		1894	1918	
130				15		UN	/ww1/ww1290.jpg	27778	0	2800	ST. SEVER CEMETERY EXTENSION (ROUEN)	ANNEXE DU CIMETIÈRE DE ST-SEVER (ROUEN)			2	France	France				30					15			1	Army	Armée	WILLIAM JOHN	P. III. K. 145.	W J	276	Seine-Maritime	<p>The St. Sever Cemetery and Extension (Rouen) is situated about 3 kilometres south of Rouen Cathedral and a short distance west of the road from Rouen to Elbeuf.  If travelling from Elbeuf or Caen on the N.138, follow Avenue Des Canadiens right down to the roundabout.  Then take the fourth exit into Rue Stanislas De Jardin, and the cemetery lies 150 metres on the left.  The CWGC signpost is located at the entrance of the cemetery.  The cemetery covers an area of 49,885 square metres.</p><p>The War Stone is on the boundary of the original Cemetery and the Extension, facing the City of Rouen War Memorial. The Cross is raised on a terrace on the further side of the Extension. The Chapel, cruciform and surmounted by a dome, is in the middle of the Extension.</p>	<p>Le cimetière et l'annexe de St-Sever (Rouen) sont situés à environ 3 kilomètres au sud de la cathédrale de Rouen et à quelque distance de la route allant de Rouen à Elbeuf, en direction ouest.  En venant d'Elbeuf  ou Caen sur la route N138, suivez l'avenue des Canadiens jusqu'au carrefour giratoire. Prenez la quatrième sortie pour vous rendre sur la rue Stanislas-de-Jardin, et le cimetière se trouve sur la gauche, à 150 mètres.  Le panneau de la Commission des sépultures de guerre du Commonwealth se trouve à l'entrée du cimetière.  Le cimetière a une superficie de 49 885 mètres carrés.</p><p>La pierre commémorative se trouve à la limite du vieux cimetière et de la nouvelle partie, en face du Monument aux morts de la ville de Rouen. La Croix se dresse sur une terrasse, du côté de la nouvelle partie. La chapelle, cruciforme et surmontée d'une coupole, se trouve au milieu de la nouvelle partie.</p>		09		2800.gif	1900	Private	Soldat	2463	4<sup>th</sup> Canadian Mounted Rifles (2<sup>nd</sup> Central Ontario Regt.)		132	633718	MARKELL			1917	
131	Son of Stephen and Jennie Marshall, of Ayr, Ontario.	Fils de Stephen et Jennie Marshall, de Ayr, Ontario.	21	15		UN	/ww1/ww1467.jpg	27779	0	2800	ST. SEVER CEMETERY EXTENSION (ROUEN)	ANNEXE DU CIMETIÈRE DE ST-SEVER (ROUEN)			2	France	France				07					15			1	Army	Armée	HOWARD ANDREW	P. IX. F. 65.	H A	276	Seine-Maritime	<p>The St. Sever Cemetery and Extension (Rouen) is situated about 3 kilometres south of Rouen Cathedral and a short distance west of the road from Rouen to Elbeuf.  If travelling from Elbeuf or Caen on the N.138, follow Avenue Des Canadiens right down to the roundabout.  Then take the fourth exit into Rue Stanislas De Jardin, and the cemetery lies 150 metres on the left.  The CWGC signpost is located at the entrance of the cemetery.  The cemetery covers an area of 49,885 square metres.</p><p>The War Stone is on the boundary of the original Cemetery and the Extension, facing the City of Rouen War Memorial. The Cross is raised on a terrace on the further side of the Extension. The Chapel, cruciform and surmounted by a dome, is in the middle of the Extension.</p>	<p>Le cimetière et l'annexe de St-Sever (Rouen) sont situés à environ 3 kilomètres au sud de la cathédrale de Rouen et à quelque distance de la route allant de Rouen à Elbeuf, en direction ouest.  En venant d'Elbeuf  ou Caen sur la route N138, suivez l'avenue des Canadiens jusqu'au carrefour giratoire. Prenez la quatrième sortie pour vous rendre sur la rue Stanislas-de-Jardin, et le cimetière se trouve sur la gauche, à 150 mètres.  Le panneau de la Commission des sépultures de guerre du Commonwealth se trouve à l'entrée du cimetière.  Le cimetière a une superficie de 49 885 mètres carrés.</p><p>La pierre commémorative se trouve à la limite du vieux cimetière et de la nouvelle partie, en face du Monument aux morts de la ville de Rouen. La Croix se dresse sur une terrasse, du côté de la nouvelle partie. La chapelle, cruciforme et surmontée d'une coupole, se trouve au milieu de la nouvelle partie.</p>		04		2800.gif	1900	Private	Soldat	337	Canadian Infantry (Central Ontario Regiment)		133	730277	MARSHALL	4th Bn.		1918	
132	Son of Philip and Bridget Martin (nee Brady); husband of Mary Martin (nee Nerney), of 116, Plymouth Grove, Montreal.	Fils de Philip et Bridget Martin (née Brady); époux de Mary Martin (née Nerney), de 116, Plymouth Grove, Montréal.	33	15		UN	/ww1/ww1133.jpg	27780	0	2800	ST. SEVER CEMETERY EXTENSION (ROUEN)	ANNEXE DU CIMETIÈRE DE ST-SEVER (ROUEN)			2	France	France	1883-02-28 00:00:00.0		28	26					15			1	Army	Armée	PHILIP	O. II. R. 4.	P	276	Seine-Maritime	<p>The St. Sever Cemetery and Extension (Rouen) is situated about 3 kilometres south of Rouen Cathedral and a short distance west of the road from Rouen to Elbeuf.  If travelling from Elbeuf or Caen on the N.138, follow Avenue Des Canadiens right down to the roundabout.  Then take the fourth exit into Rue Stanislas De Jardin, and the cemetery lies 150 metres on the left.  The CWGC signpost is located at the entrance of the cemetery.  The cemetery covers an area of 49,885 square metres.</p><p>The War Stone is on the boundary of the original Cemetery and the Extension, facing the City of Rouen War Memorial. The Cross is raised on a terrace on the further side of the Extension. The Chapel, cruciform and surmounted by a dome, is in the middle of the Extension.</p>	<p>Le cimetière et l'annexe de St-Sever (Rouen) sont situés à environ 3 kilomètres au sud de la cathédrale de Rouen et à quelque distance de la route allant de Rouen à Elbeuf, en direction ouest.  En venant d'Elbeuf  ou Caen sur la route N138, suivez l'avenue des Canadiens jusqu'au carrefour giratoire. Prenez la quatrième sortie pour vous rendre sur la rue Stanislas-de-Jardin, et le cimetière se trouve sur la gauche, à 150 mètres.  Le panneau de la Commission des sépultures de guerre du Commonwealth se trouve à l'entrée du cimetière.  Le cimetière a une superficie de 49 885 mètres carrés.</p><p>La pierre commémorative se trouve à la limite du vieux cimetière et de la nouvelle partie, en face du Monument aux morts de la ville de Rouen. La Croix se dresse sur une terrasse, du côté de la nouvelle partie. La chapelle, cruciforme et surmontée d'une coupole, se trouve au milieu de la nouvelle partie.</p>	02	11		2800.gif	2183	Sergeant	Sergent	291	Canadian Infantry, Canadian Expeditionary Force		134	132048	MARTIN	"""A"" Coy."	1883	1916	
