340	Son of James H. and Louise Lavallee (nee Harvey). Husband of Annabelle B. Lavallee (nee Crooks), of Walkerville, Ontario.	Fils de James H. et Louise Lavallee (née Harvey). Époux d'Annabelle B. Lavallee (née Crooks), de Walkerville, Ontario.	25	15		UN	/ww1/ww1589.jpg	519043	0	2800	ST. SEVER CEMETERY EXTENSION (ROUEN)	ANNEXE DU CIMETIÈRE DE ST-SEVER (ROUEN)			2	France	France				20		1		UN	15	Walkerville	ON	1	Army	Armée	RALPH PROSPER	S. IV. H. 12.	R P	276	Seine-Maritime	<p>The St. Sever Cemetery and Extension (Rouen) is situated about 3 kilometres south of Rouen Cathedral and a short distance west of the road from Rouen to Elbeuf.  If travelling from Elbeuf or Caen on the N.138, follow Avenue Des Canadiens right down to the roundabout.  Then take the fourth exit into Rue Stanislas De Jardin, and the cemetery lies 150 metres on the left.  The CWGC signpost is located at the entrance of the cemetery.  The cemetery covers an area of 49,885 square metres.</p><p>The War Stone is on the boundary of the original Cemetery and the Extension, facing the City of Rouen War Memorial. The Cross is raised on a terrace on the further side of the Extension. The Chapel, cruciform and surmounted by a dome, is in the middle of the Extension.</p>	<p>Le cimetière et l'annexe de St-Sever (Rouen) sont situés à environ 3 kilomètres au sud de la cathédrale de Rouen et à quelque distance de la route allant de Rouen à Elbeuf, en direction ouest.  En venant d'Elbeuf  ou Caen sur la route N138, suivez l'avenue des Canadiens jusqu'au carrefour giratoire. Prenez la quatrième sortie pour vous rendre sur la rue Stanislas-de-Jardin, et le cimetière se trouve sur la gauche, à 150 mètres.  Le panneau de la Commission des sépultures de guerre du Commonwealth se trouve à l'entrée du cimetière.  Le cimetière a une superficie de 49 885 mètres carrés.</p><p>La pierre commémorative se trouve à la limite du vieux cimetière et de la nouvelle partie, en face du Monument aux morts de la ville de Rouen. La Croix se dresse sur une terrasse, du côté de la nouvelle partie. La chapelle, cruciforme et surmontée d'une coupole, se trouve au milieu de la nouvelle partie.</p>		12		2800.gif	921	Corporal	Caporal	3024	Royal Army Service Corps		342	M2/153389	LAVALLEE	Mechanical Transport, 4th Heavy Repair Shop,		1918	
341				15		UN	/ww2/ww2603.jpg	2095558	0	2800	ST. SEVER CEMETERY EXTENSION (ROUEN)	ANNEXE DU CIMETIÈRE DE ST-SEVER (ROUEN)			2	France	France				05		1		UN	15		UN	2	Air Force	Aviation militaire	JOHN ADAMSON	"Block ""S"". Plot 4. Row O. Grave 4."	J A	276	Seine-Maritime	<p>The St. Sever Cemetery and Extension (Rouen) is situated about 3 kilometres south of Rouen Cathedral and a short distance west of the road from Rouen to Elbeuf.  If travelling from Elbeuf or Caen on the N.138, follow Avenue Des Canadiens right down to the roundabout.  Then take the fourth exit into Rue Stanislas De Jardin, and the cemetery lies 150 metres on the left.  The CWGC signpost is located at the entrance of the cemetery.  The cemetery covers an area of 49,885 square metres.</p><p>The War Stone is on the boundary of the original Cemetery and the Extension, facing the City of Rouen War Memorial. The Cross is raised on a terrace on the further side of the Extension. The Chapel, cruciform and surmounted by a dome, is in the middle of the Extension.</p>	<p>Le cimetière et l'annexe de St-Sever (Rouen) sont situés à environ 3 kilomètres au sud de la cathédrale de Rouen et à quelque distance de la route allant de Rouen à Elbeuf, en direction ouest.  En venant d'Elbeuf  ou Caen sur la route N138, suivez l'avenue des Canadiens jusqu'au carrefour giratoire. Prenez la quatrième sortie pour vous rendre sur la rue Stanislas-de-Jardin, et le cimetière se trouve sur la gauche, à 150 mètres.  Le panneau de la Commission des sépultures de guerre du Commonwealth se trouve à l'entrée du cimetière.  Le cimetière a une superficie de 49 885 mètres carrés.</p><p>La pierre commémorative se trouve à la limite du vieux cimetière et de la nouvelle partie, en face du Monument aux morts de la ville de Rouen. La Croix se dresse sur une terrasse, du côté de la nouvelle partie. La chapelle, cruciforme et surmontée d'une coupole, se trouve au milieu de la nouvelle partie.</p>		06		2800.gif	1869	Pilot Officer	Sous-lieutenant d'aviation	1776	Royal Air Force		343	41621	SHEPHERD	1 Sqdn.		1940	
342	Son of Ellis William and Amy Allen. Husband of Sarah Marion Allen, of Amherstburg, Ontario.	Fils de Ellis William et Amy Allen. Époux de Sarah Marion Allen, de Amherstburg, Ontario.	32	15		UN	/ww2/ww2054.jpg	2095309	0	2800	ST. SEVER CEMETERY EXTENSION (ROUEN)	ANNEXE DU CIMETIÈRE DE ST-SEVER (ROUEN)			2	France	France				29		1		UN	15		UN	1	Army	Armée	ELLIS WILLIAM	"Plot 4. Row P. Grave 21, Block ""S"""	E W	276	Seine-Maritime	<p>The St. Sever Cemetery and Extension (Rouen) is situated about 3 kilometres south of Rouen Cathedral and a short distance west of the road from Rouen to Elbeuf.  If travelling from Elbeuf or Caen on the N.138, follow Avenue Des Canadiens right down to the roundabout.  Then take the fourth exit into Rue Stanislas De Jardin, and the cemetery lies 150 metres on the left.  The CWGC signpost is located at the entrance of the cemetery.  The cemetery covers an area of 49,885 square metres.</p><p>The War Stone is on the boundary of the original Cemetery and the Extension, facing the City of Rouen War Memorial. The Cross is raised on a terrace on the further side of the Extension. The Chapel, cruciform and surmounted by a dome, is in the middle of the Extension.</p>	<p>Le cimetière et l'annexe de St-Sever (Rouen) sont situés à environ 3 kilomètres au sud de la cathédrale de Rouen et à quelque distance de la route allant de Rouen à Elbeuf, en direction ouest.  En venant d'Elbeuf  ou Caen sur la route N138, suivez l'avenue des Canadiens jusqu'au carrefour giratoire. Prenez la quatrième sortie pour vous rendre sur la rue Stanislas-de-Jardin, et le cimetière se trouve sur la gauche, à 150 mètres.  Le panneau de la Commission des sépultures de guerre du Commonwealth se trouve à l'entrée du cimetière.  Le cimetière a une superficie de 49 885 mètres carrés.</p><p>La pierre commémorative se trouve à la limite du vieux cimetière et de la nouvelle partie, en face du Monument aux morts de la ville de Rouen. La Croix se dresse sur une terrasse, du côté de la nouvelle partie. La chapelle, cruciforme et surmontée d'une coupole, se trouve au milieu de la nouvelle partie.</p>		08		2800.gif	1900	Private	Soldat	483	Essex Scottish Regiment, R.C.I.C.		344	A/22381	ALLEN			1942	
343	Son of Wilford J. and Bessie Astle, of Millinocket, Maine.	Fils de Wilford J. et Bessie Astle, de Millinocket, Maine.	31	15	Timmins	ON	/ww2/ww2055.jpg	2095311	0	2800	ST. SEVER CEMETERY EXTENSION (ROUEN)	ANNEXE DU CIMETIÈRE DE ST-SEVER (ROUEN)			2	France	France	1911-07-07 00:00:00.0	1941-04-10 00:00:00.0	07	19	10	2	Dieppe	OT	15	Toronto	ON	1	Army	Armée	TYLER LEVITA	Plot 4. Row R. Grave 17. Block S	T L	276	Seine-Maritime	<p>The St. Sever Cemetery and Extension (Rouen) is situated about 3 kilometres south of Rouen Cathedral and a short distance west of the road from Rouen to Elbeuf.  If travelling from Elbeuf or Caen on the N.138, follow Avenue Des Canadiens right down to the roundabout.  Then take the fourth exit into Rue Stanislas De Jardin, and the cemetery lies 150 metres on the left.  The CWGC signpost is located at the entrance of the cemetery.  The cemetery covers an area of 49,885 square metres.</p><p>The War Stone is on the boundary of the original Cemetery and the Extension, facing the City of Rouen War Memorial. The Cross is raised on a terrace on the further side of the Extension. The Chapel, cruciform and surmounted by a dome, is in the middle of the Extension.</p>	<p>Le cimetière et l'annexe de St-Sever (Rouen) sont situés à environ 3 kilomètres au sud de la cathédrale de Rouen et à quelque distance de la route allant de Rouen à Elbeuf, en direction ouest.  En venant d'Elbeuf  ou Caen sur la route N138, suivez l'avenue des Canadiens jusqu'au carrefour giratoire. Prenez la quatrième sortie pour vous rendre sur la rue Stanislas-de-Jardin, et le cimetière se trouve sur la gauche, à 150 mètres.  Le panneau de la Commission des sépultures de guerre du Commonwealth se trouve à l'entrée du cimetière.  Le cimetière a une superficie de 49 885 mètres carrés.</p><p>La pierre commémorative se trouve à la limite du vieux cimetière et de la nouvelle partie, en face du Monument aux morts de la ville de Rouen. La Croix se dresse sur une terrasse, du côté de la nouvelle partie. La chapelle, cruciforme et surmontée d'une coupole, se trouve au milieu de la nouvelle partie.</p>	07	08	04	2800.gif	1900	Private	Soldat	1904	Royal Regiment of Canada, R.C.I.C.		345	B/68124	ASTLE		1911	1942	1941
344	Son of James and Cecilia Batt, of Woodstock, Ontario.	Fils de James et Cecilia Batt, de Woodstock, Ontario.	21	15		UN	/ww2/ww2244.jpg	2095317	0	2800	ST. SEVER CEMETERY EXTENSION (ROUEN)	ANNEXE DU CIMETIÈRE DE ST-SEVER (ROUEN)			2	France	France				18		1		UN	15		UN	2	Air Force	Aviation militaire	JAMES HENRY	"Block ""S"". Plot 1. Row N. Joint grave 20."	J H	276	Seine-Maritime	<p>The St. Sever Cemetery and Extension (Rouen) is situated about 3 kilometres south of Rouen Cathedral and a short distance west of the road from Rouen to Elbeuf.  If travelling from Elbeuf or Caen on the N.138, follow Avenue Des Canadiens right down to the roundabout.  Then take the fourth exit into Rue Stanislas De Jardin, and the cemetery lies 150 metres on the left.  The CWGC signpost is located at the entrance of the cemetery.  The cemetery covers an area of 49,885 square metres.</p><p>The War Stone is on the boundary of the original Cemetery and the Extension, facing the City of Rouen War Memorial. The Cross is raised on a terrace on the further side of the Extension. The Chapel, cruciform and surmounted by a dome, is in the middle of the Extension.</p>	<p>Le cimetière et l'annexe de St-Sever (Rouen) sont situés à environ 3 kilomètres au sud de la cathédrale de Rouen et à quelque distance de la route allant de Rouen à Elbeuf, en direction ouest.  En venant d'Elbeuf  ou Caen sur la route N138, suivez l'avenue des Canadiens jusqu'au carrefour giratoire. Prenez la quatrième sortie pour vous rendre sur la rue Stanislas-de-Jardin, et le cimetière se trouve sur la gauche, à 150 mètres.  Le panneau de la Commission des sépultures de guerre du Commonwealth se trouve à l'entrée du cimetière.  Le cimetière a une superficie de 49 885 mètres carrés.</p><p>La pierre commémorative se trouve à la limite du vieux cimetière et de la nouvelle partie, en face du Monument aux morts de la ville de Rouen. La Croix se dresse sur une terrasse, du côté de la nouvelle partie. La chapelle, cruciforme et surmontée d'une coupole, se trouve au milieu de la nouvelle partie.</p>		08		2800.gif	1191	Flight Sergeant	Sergent de section	1809	Royal Canadian Air Force		346	R/189665	BATT			1944	
345	Son of Henri and Delisea Beauvais, of Montreal, Quebec.	Fils de Henri et Delisea Beauvais, de Montréal, Québec.	24	15		UN	/ww2/ww2057.jpg	2095320	0	2800	ST. SEVER CEMETERY EXTENSION (ROUEN)	ANNEXE DU CIMETIÈRE DE ST-SEVER (ROUEN)			2	France	France				24		1		UN	15		UN	1	Army	Armée	ARMAND	Block S, Plot 4. Row P. Grave 13.	A	276	Seine-Maritime	<p>The St. Sever Cemetery and Extension (Rouen) is situated about 3 kilometres south of Rouen Cathedral and a short distance west of the road from Rouen to Elbeuf.  If travelling from Elbeuf or Caen on the N.138, follow Avenue Des Canadiens right down to the roundabout.  Then take the fourth exit into Rue Stanislas De Jardin, and the cemetery lies 150 metres on the left.  The CWGC signpost is located at the entrance of the cemetery.  The cemetery covers an area of 49,885 square metres.</p><p>The War Stone is on the boundary of the original Cemetery and the Extension, facing the City of Rouen War Memorial. The Cross is raised on a terrace on the further side of the Extension. The Chapel, cruciform and surmounted by a dome, is in the middle of the Extension.</p>	<p>Le cimetière et l'annexe de St-Sever (Rouen) sont situés à environ 3 kilomètres au sud de la cathédrale de Rouen et à quelque distance de la route allant de Rouen à Elbeuf, en direction ouest.  En venant d'Elbeuf  ou Caen sur la route N138, suivez l'avenue des Canadiens jusqu'au carrefour giratoire. Prenez la quatrième sortie pour vous rendre sur la rue Stanislas-de-Jardin, et le cimetière se trouve sur la gauche, à 150 mètres.  Le panneau de la Commission des sépultures de guerre du Commonwealth se trouve à l'entrée du cimetière.  Le cimetière a une superficie de 49 885 mètres carrés.</p><p>La pierre commémorative se trouve à la limite du vieux cimetière et de la nouvelle partie, en face du Monument aux morts de la ville de Rouen. La Croix se dresse sur une terrasse, du côté de la nouvelle partie. La chapelle, cruciforme et surmontée d'une coupole, se trouve au milieu de la nouvelle partie.</p>		10		2800.gif	1900	Private	Soldat	1098	Les Fusiliers Mont-Royal, R.C.I.C.		347	D/57162	BEAUVAIS			1942	
346	Son of Alphonse and Valerie Belanger, of Selkirk, Manitoba. Brother of Albert, Clovis, Paul, Napolean, Albert, Annette, Alice, Jean and Pauline.	Fils de Alphonse et Valerie Belanger, de Selkirk (Manitoba). Frère de Albert, Clovis, Paul, Napolean, Albert, Annette, Alice, Jean and Pauline.	22	15	Selkirk	MB	/ww2/ww2057.jpg	2095322	0	2800	ST. SEVER CEMETERY EXTENSION (ROUEN)	ANNEXE DU CIMETIÈRE DE ST-SEVER (ROUEN)	1939-45 Star, Defence Medal, War Medal, Canadian Volunteer Service Medal and Clasp.	Étoile de 1939-45, Médaille du défense, Médaille de la guerre, Médaille canadienne du volontaire et agrafe.	2	France	France	1920-01-01 00:00:00.0	1940-06-11 00:00:00.0	01	19	11	1		UN	15	Winnipeg	MB	1	Army	Armée	ALPHONSE GAUDIAS	Block S, Plot 4, Row R, Grave 21	A G	276	Seine-Maritime	<p>The St. Sever Cemetery and Extension (Rouen) is situated about 3 kilometres south of Rouen Cathedral and a short distance west of the road from Rouen to Elbeuf.  If travelling from Elbeuf or Caen on the N.138, follow Avenue Des Canadiens right down to the roundabout.  Then take the fourth exit into Rue Stanislas De Jardin, and the cemetery lies 150 metres on the left.  The CWGC signpost is located at the entrance of the cemetery.  The cemetery covers an area of 49,885 square metres.</p><p>The War Stone is on the boundary of the original Cemetery and the Extension, facing the City of Rouen War Memorial. The Cross is raised on a terrace on the further side of the Extension. The Chapel, cruciform and surmounted by a dome, is in the middle of the Extension.</p>	<p>Le cimetière et l'annexe de St-Sever (Rouen) sont situés à environ 3 kilomètres au sud de la cathédrale de Rouen et à quelque distance de la route allant de Rouen à Elbeuf, en direction ouest.  En venant d'Elbeuf  ou Caen sur la route N138, suivez l'avenue des Canadiens jusqu'au carrefour giratoire. Prenez la quatrième sortie pour vous rendre sur la rue Stanislas-de-Jardin, et le cimetière se trouve sur la gauche, à 150 mètres.  Le panneau de la Commission des sépultures de guerre du Commonwealth se trouve à l'entrée du cimetière.  Le cimetière a une superficie de 49 885 mètres carrés.</p><p>La pierre commémorative se trouve à la limite du vieux cimetière et de la nouvelle partie, en face du Monument aux morts de la ville de Rouen. La Croix se dresse sur une terrasse, du côté de la nouvelle partie. La chapelle, cruciforme et surmontée d'une coupole, se trouve au milieu de la nouvelle partie.</p>	01	08	06	2800.gif	1900	Private	Soldat	1384	Queen's Own Cameron Highlanders of Canada		348	H/20283	BELANGER		1920	1942	1940
347				15		UN	/ww2/ww2258.jpg	2095334	0	2800	ST. SEVER CEMETERY EXTENSION (ROUEN)	ANNEXE DU CIMETIÈRE DE ST-SEVER (ROUEN)			2	France	France				18		1		UN	15		UN	2	Air Force	Aviation militaire	ROBERT ARTHUR	"Block ""S"". Plot 1. Row N. Joint grave 20."	R A	276	Seine-Maritime	<p>The St. Sever Cemetery and Extension (Rouen) is situated about 3 kilometres south of Rouen Cathedral and a short distance west of the road from Rouen to Elbeuf.  If travelling from Elbeuf or Caen on the N.138, follow Avenue Des Canadiens right down to the roundabout.  Then take the fourth exit into Rue Stanislas De Jardin, and the cemetery lies 150 metres on the left.  The CWGC signpost is located at the entrance of the cemetery.  The cemetery covers an area of 49,885 square metres.</p><p>The War Stone is on the boundary of the original Cemetery and the Extension, facing the City of Rouen War Memorial. The Cross is raised on a terrace on the further side of the Extension. The Chapel, cruciform and surmounted by a dome, is in the middle of the Extension.</p>	<p>Le cimetière et l'annexe de St-Sever (Rouen) sont situés à environ 3 kilomètres au sud de la cathédrale de Rouen et à quelque distance de la route allant de Rouen à Elbeuf, en direction ouest.  En venant d'Elbeuf  ou Caen sur la route N138, suivez l'avenue des Canadiens jusqu'au carrefour giratoire. Prenez la quatrième sortie pour vous rendre sur la rue Stanislas-de-Jardin, et le cimetière se trouve sur la gauche, à 150 mètres.  Le panneau de la Commission des sépultures de guerre du Commonwealth se trouve à l'entrée du cimetière.  Le cimetière a une superficie de 49 885 mètres carrés.</p><p>La pierre commémorative se trouve à la limite du vieux cimetière et de la nouvelle partie, en face du Monument aux morts de la ville de Rouen. La Croix se dresse sur une terrasse, du côté de la nouvelle partie. La chapelle, cruciforme et surmontée d'une coupole, se trouve au milieu de la nouvelle partie.</p>		08		2800.gif	1869	Pilot Officer	Sous-lieutenant d'aviation	1809	Royal Canadian Air Force		349	J/88104	BRETT			1944	
348	Son of Oscar and Nannie Carlson, of Lakeview, Ontario.	Fils de Oscar et Nannie Carlson, de Lakeview, Ontario.	21	15		UN	/ww2/ww2268.jpg	2095348	0	2800	ST. SEVER CEMETERY EXTENSION (ROUEN)	ANNEXE DU CIMETIÈRE DE ST-SEVER (ROUEN)			2	France	France				08		1		UN	15		UN	2	Air Force	Aviation militaire	ERNEST WILLIAM BERNARD	"Block ""S"". Plot 4. Row P. Grave 2."	E W B	276	Seine-Maritime	<p>The St. Sever Cemetery and Extension (Rouen) is situated about 3 kilometres south of Rouen Cathedral and a short distance west of the road from Rouen to Elbeuf.  If travelling from Elbeuf or Caen on the N.138, follow Avenue Des Canadiens right down to the roundabout.  Then take the fourth exit into Rue Stanislas De Jardin, and the cemetery lies 150 metres on the left.  The CWGC signpost is located at the entrance of the cemetery.  The cemetery covers an area of 49,885 square metres.</p><p>The War Stone is on the boundary of the original Cemetery and the Extension, facing the City of Rouen War Memorial. The Cross is raised on a terrace on the further side of the Extension. The Chapel, cruciform and surmounted by a dome, is in the middle of the Extension.</p>	<p>Le cimetière et l'annexe de St-Sever (Rouen) sont situés à environ 3 kilomètres au sud de la cathédrale de Rouen et à quelque distance de la route allant de Rouen à Elbeuf, en direction ouest.  En venant d'Elbeuf  ou Caen sur la route N138, suivez l'avenue des Canadiens jusqu'au carrefour giratoire. Prenez la quatrième sortie pour vous rendre sur la rue Stanislas-de-Jardin, et le cimetière se trouve sur la gauche, à 150 mètres.  Le panneau de la Commission des sépultures de guerre du Commonwealth se trouve à l'entrée du cimetière.  Le cimetière a une superficie de 49 885 mètres carrés.</p><p>La pierre commémorative se trouve à la limite du vieux cimetière et de la nouvelle partie, en face du Monument aux morts de la ville de Rouen. La Croix se dresse sur une terrasse, du côté de la nouvelle partie. La chapelle, cruciforme et surmontée d'une coupole, se trouve au milieu de la nouvelle partie.</p>		06		2800.gif	1869	Pilot Officer	Sous-lieutenant d'aviation	1809	Royal Canadian Air Force		350	J/90367	CARLSON	138 (R.A.F.) Sqdn		1944	
349	Son of Albert John Coon, and of Mary Elizabeth Coon, of Hines Creek, Alberta.	Fils de Albert John Coon, et de Mary Elizabeth Coon, de Hines Creek, Alberta.	20	15		UN	/ww2/ww2278.jpg	2095361	0	2800	ST. SEVER CEMETERY EXTENSION (ROUEN)	ANNEXE DU CIMETIÈRE DE ST-SEVER (ROUEN)			2	France	France				04		1		UN	15		UN	2	Air Force	Aviation militaire	GEORGE ADRIAN	"Plot 4. Row T. Coll. grave 17-22. Block ""S""."	G A	276	Seine-Maritime	<p>The St. Sever Cemetery and Extension (Rouen) is situated about 3 kilometres south of Rouen Cathedral and a short distance west of the road from Rouen to Elbeuf.  If travelling from Elbeuf or Caen on the N.138, follow Avenue Des Canadiens right down to the roundabout.  Then take the fourth exit into Rue Stanislas De Jardin, and the cemetery lies 150 metres on the left.  The CWGC signpost is located at the entrance of the cemetery.  The cemetery covers an area of 49,885 square metres.</p><p>The War Stone is on the boundary of the original Cemetery and the Extension, facing the City of Rouen War Memorial. The Cross is raised on a terrace on the further side of the Extension. The Chapel, cruciform and surmounted by a dome, is in the middle of the Extension.</p>	<p>Le cimetière et l'annexe de St-Sever (Rouen) sont situés à environ 3 kilomètres au sud de la cathédrale de Rouen et à quelque distance de la route allant de Rouen à Elbeuf, en direction ouest.  En venant d'Elbeuf  ou Caen sur la route N138, suivez l'avenue des Canadiens jusqu'au carrefour giratoire. Prenez la quatrième sortie pour vous rendre sur la rue Stanislas-de-Jardin, et le cimetière se trouve sur la gauche, à 150 mètres.  Le panneau de la Commission des sépultures de guerre du Commonwealth se trouve à l'entrée du cimetière.  Le cimetière a une superficie de 49 885 mètres carrés.</p><p>La pierre commémorative se trouve à la limite du vieux cimetière et de la nouvelle partie, en face du Monument aux morts de la ville de Rouen. La Croix se dresse sur une terrasse, du côté de la nouvelle partie. La chapelle, cruciforme et surmontée d'une coupole, se trouve au milieu de la nouvelle partie.</p>		05		2800.gif	1191	Flight Sergeant	Sergent de section	1809	Royal Canadian Air Force		351	R/178848	COON			1944	
350	Son of Louis and Eva Dumaine, Of Montreal, Province of Quebec. Husband of Eva Dumaine, of Montreal.	Fils de Louis et Eva Dumaine, Of Montréal, Province de Québec. Époux de Eva Dumaine, de Montréal.	35	15		UN	/ww2/ww2070.jpg	2095378	0	2800	ST. SEVER CEMETERY EXTENSION (ROUEN)	ANNEXE DU CIMETIÈRE DE ST-SEVER (ROUEN)			2	France	France				19		1		UN	15		UN	1	Army	Armée	JEAN LOUIS	Plot 4. Row R. Grave 5. Block S	J L	276	Seine-Maritime	<p>The St. Sever Cemetery and Extension (Rouen) is situated about 3 kilometres south of Rouen Cathedral and a short distance west of the road from Rouen to Elbeuf.  If travelling from Elbeuf or Caen on the N.138, follow Avenue Des Canadiens right down to the roundabout.  Then take the fourth exit into Rue Stanislas De Jardin, and the cemetery lies 150 metres on the left.  The CWGC signpost is located at the entrance of the cemetery.  The cemetery covers an area of 49,885 square metres.</p><p>The War Stone is on the boundary of the original Cemetery and the Extension, facing the City of Rouen War Memorial. The Cross is raised on a terrace on the further side of the Extension. The Chapel, cruciform and surmounted by a dome, is in the middle of the Extension.</p>	<p>Le cimetière et l'annexe de St-Sever (Rouen) sont situés à environ 3 kilomètres au sud de la cathédrale de Rouen et à quelque distance de la route allant de Rouen à Elbeuf, en direction ouest.  En venant d'Elbeuf  ou Caen sur la route N138, suivez l'avenue des Canadiens jusqu'au carrefour giratoire. Prenez la quatrième sortie pour vous rendre sur la rue Stanislas-de-Jardin, et le cimetière se trouve sur la gauche, à 150 mètres.  Le panneau de la Commission des sépultures de guerre du Commonwealth se trouve à l'entrée du cimetière.  Le cimetière a une superficie de 49 885 mètres carrés.</p><p>La pierre commémorative se trouve à la limite du vieux cimetière et de la nouvelle partie, en face du Monument aux morts de la ville de Rouen. La Croix se dresse sur une terrasse, du côté de la nouvelle partie. La chapelle, cruciforme et surmontée d'une coupole, se trouve au milieu de la nouvelle partie.</p>		08		2800.gif	1900	Private	Soldat	1098	Les Fusiliers Mont-Royal, R.C.I.C.		352	D/61355	DUMAINE			1942	
